{
  "id": "CS-SALES-20260225-001",
  "work_packet_id": "WP-SALES-20260225-001",
  "change_type": "feature",
  "architectural_flag": false,
  "requires_pressure_test": false,
  "modified_paths": [
    "src/data/types/factfinder.ts",
    "src/data/queries/factfinder.ts",
    "src/app/meetings/meeting1/service.ts",
    "src/ui/pages/sales/Meeting1.tsx"
  ],
  "summary": "Wired Meeting 1 Fact Finder form to persist data to sales.sales_factfinder via the data layer. Created Zod types (data/types), query functions (data/queries), orchestration service (app/meetings/meeting1), and updated Meeting1.tsx to call the service on save and hydrate from existing data on mount. Only the 4 declared columns (employer_name, employee_count, renewal_month, prior_broker) are persisted per the work packet scope.",
  "doctrine_version": "3.3.0",
  "timestamp": "2026-02-25T12:30:00Z",
  "payload": {
    "files_created": [
      "src/data/types/factfinder.ts",
      "src/data/queries/factfinder.ts",
      "src/app/meetings/meeting1/service.ts"
    ],
    "files_modified": [
      "src/ui/pages/sales/Meeting1.tsx"
    ],
    "imo_layer_verification": {
      "ingress": "Meeting1.tsx — Zod safeParse validates form input before passing to Middle layer",
      "middle": "src/app/meetings/meeting1/service.ts — orchestrates mint → upsert → error logging",
      "egress": "Toast notification to UI on success/failure — no external egress"
    },
    "ctb_branch_compliance": {
      "data_types": "src/data/types/factfinder.ts — Zod schemas for all factfinder tables",
      "data_queries": "src/data/queries/factfinder.ts — all Supabase access isolated here",
      "app_service": "src/app/meetings/meeting1/service.ts — business logic in app/",
      "ui_page": "src/ui/pages/sales/Meeting1.tsx — no direct Supabase imports"
    },
    "deferred_fields_note": "~26 additional form fields not persisted — requires column_registry.yml expansion + separate work packet"
  }
}
